PuzzleId,FEN,Moves,Rating,RatingDeviation,Popularity,NbPlays,Themes,GameUrl,OpeningTags,Queen_Bishop,puzzle_ref
jFwnq,5r1k/1bp2pp1/1p3R1p/3P2N1/2PQ4/3B4/3q2PP/6K1 b - - 0 30,g7f6 d4f6 h8g8 d3h7,1140,75,100,260,endgame mate mateIn2 short,https://lichess.org/sYB4pLe9/black#60,,True,https://lichess.org/training/jFwnq
jMcBz,r6k/pp5p/2p1ppR1/8/8/1P1PQ1KB/P1q5/8 b - - 0 36,h7g6 e3h6 h8g8 h3e6,983,86,95,7090,endgame mate mateIn2 short,https://lichess.org/C2BXt37K/black#72,,True,https://lichess.org/training/jMcBz
jTtS1,r3k2r/1p3p2/2p1Rn2/p1B3p1/P1QP3p/5q1P/1PP2P1K/5R2 b kq - 0 25,f7e6 c4e6 e8d8 c5b6,1867,75,90,1417,mate mateIn2 middlegame short,https://lichess.org/MdeZGeI3/black#50,,True,https://lichess.org/training/jTtS1
jUXxt,5k2/1p3BbQ/p7/2pP2p1/2P3q1/8/P5K1/6RR w - - 5 42,g2f1 g4f3 f1e1 g7c3,1830,74,92,4377,endgame mate mateIn2 short,https://lichess.org/08SkkQVX#83,,True,https://lichess.org/training/jUXxt
jVe43,4r1k1/5p1p/R5p1/1p3q2/1P6/P1Q1P2P/5PPb/2R2K2 w - - 1 35,c3c6 f5d3 f1e1 e8e3 f2e3 h2g3,1984,90,88,61,endgame long mate mateIn3 sacrifice,https://lichess.org/jy3lm2yX#69,,True,https://lichess.org/training/jVe43
jaSrr,5k2/ppp4p/3qP3/3p2Q1/3P2P1/2N4P/PPb5/R5K1 w - - 2 29,c3d5 d6g3 g1f1 c2d3,1190,75,88,526,endgame mate mateIn2 short,https://lichess.org/D1Emj938#57,,True,https://lichess.org/training/jaSrr
jljy7,8/2Pk4/Q4b2/1p1r1p2/3Pp3/1P2K1q1/P7/2RR4 w - - 0 41,e3d2 g3d3 d2e1 f6h4,2075,77,94,7217,endgame mate mateIn2 short,https://lichess.org/oUQ60I6u#81,,True,https://lichess.org/training/jljy7
jmYcE,Bnbr2k1/p4pp1/1p3P1p/2p1P3/7P/P1P2Nq1/2P3P1/R1B2KQn w - - 5 21,c1b2 c8a6 c3c4 a6c4,1780,99,79,27,mate mateIn2 middlegame short,https://lichess.org/DEHTKcQ7#41,,True,https://lichess.org/training/jmYcE
ju8TZ,2k5/5p1p/3Q2p1/1B6/P2P1P2/8/3q1PKP/2q5 b - - 0 43,d2f4 b5a6,1722,83,87,2260,endgame master mate mateIn1 oneMove,https://lichess.org/xZhfEgAJ/black#86,,True,https://lichess.org/training/ju8TZ
jzObq,6k1/2p5/p6q/1p1b2p1/5p2/2PP1NK1/PPB2QP1/8 w - - 0 37,g3g4 d5e6,1460,83,84,63,endgame mate mateIn1 oneMove,https://lichess.org/b4YF5rMg#73,,True,https://lichess.org/training/jzObq
k0Joi,4k3/3n4/1b1Q1np1/2p3Np/1pB4P/5P2/1PP2KP1/4r2r b - - 6 37,b6d8 c4f7,1141,76,97,3999,master masterVsMaster mate mateIn1 middlegame oneMove,https://lichess.org/F2S1GVvy/black#74,,True,https://lichess.org/training/k0Joi
k0zZ9,6k1/p4p2/6R1/4BQpp/2q3r1/P6K/5P2/8 b - - 7 36,f7g6 f5g6 g8f8 e5d6,1817,74,100,276,endgame mate mateIn2 short,https://lichess.org/k347vkOx/black#72,,True,https://lichess.org/training/k0zZ9
k7CL5,2kq3r/pp3p2/5np1/1N1pQ3/2p4r/2P1PP2/PPB5/1K2R3 b - - 3 31,h4h1 b5a7 c8d7 c2a4 b7b5 a4b5,1942,75,87,522,long mate mateIn3 middlegame queensideAttack,https://lichess.org/MFP9Ivyv/black#62,,True,https://lichess.org/training/k7CL5
kCIju,r1b1k2r/pp1p4/4p1Q1/8/8/N7/PbPBKP1P/q7 b - - 0 20,e8f8 d2b4 d7d6 b4d6,1722,76,80,142,mate mateIn2 middlegame short,https://lichess.org/QzQM6Yet/black#40,,True,https://lichess.org/training/kCIju
kFDsQ,2R5/3P2pk/7p/4p1b1/4b3/6qP/6P1/6QK w - - 0 45,d7d8q g3h3 g1h2 e4g2 h1g1 g5e3,1748,75,96,9175,endgame long mate mateIn3 pin,https://lichess.org/6VIYc9RN#89,,True,https://lichess.org/training/kFDsQ
kNi8L,1r6/5rk1/4Q3/4P3/p4B2/bpPqP2P/PP1p1P2/K5R1 b - - 1 32,g7f8 f4h6 f7g7 h6g7,1389,80,77,82,mate mateIn2 middlegame short,https://lichess.org/KpVm26MY/black#64,,True,https://lichess.org/training/kNi8L
kPMON,4kb2/pp3p1Q/4p3/3p1p2/8/2rqB2P/PP1N4/2KR4 w - - 0 22,b2c3 f8a3,1417,84,93,137,endgame master mate mateIn1 oneMove,https://lichess.org/OdCF5IV1#43,,True,https://lichess.org/training/kPMON
kWa8H,r5k1/q2nb3/3p1nPQ/3PpB1P/8/Pr3P2/1P6/1K1R2R1 b - - 0 27,a7a3 f5e6,1525,86,89,3096,master masterVsMaster mate mateIn1 middlegame oneMove,https://lichess.org/GuH9MhtT/black#54,,True,https://lichess.org/training/kWa8H
kdaBD,1r5k/8/p4p1p/1p3P2/3RB1PQ/4bK2/PP6/6q1 b - - 6 35,e3d4 h4h6 h8g8 e4d5,1345,75,81,811,endgame mate mateIn2 short,https://lichess.org/Wujrgmvy/black#70,,True,https://lichess.org/training/kdaBD
kgCGZ,r3k2r/ppp2pp1/2n5/2bpp3/8/PP1PP1Pq/1BPN2KP/R2Q3R w kq - 2 16,g2g1 c5e3,860,81,92,258,kingsideAttack mate mateIn1 middlegame oneMove,https://lichess.org/AAhaypJK#31,Nimzo-Larsen_Attack Nimzo-Larsen_Attack_Modern_Variation,True,https://lichess.org/training/kgCGZ
kgZAC,7k/8/3p1pQ1/p1q1b2p/4P2P/8/P5P1/5B1K b - - 2 47,c5f2 g6h6 h8g8 f1c4 d6d5 c4d5,1752,75,95,1656,endgame exposedKing long mate mateIn3,https://lichess.org/WXqoOqJX/black#94,,True,https://lichess.org/training/kgZAC
khgPi,3qk2r/r2b1pp1/p2Q4/2pB4/2P1P1np/1PP5/P4bP1/R1B2R1K b k - 2 27,f2g3 d5f7,1142,80,79,492,attackingF2F7 mate mateIn1 middlegame oneMove,https://lichess.org/OyKkVs9n/black#54,,True,https://lichess.org/training/khgPi
kkbTz,3rr3/pp1k1qp1/2p1b3/3nQp2/3Pp2p/BP2P2P/P3BPP1/2R2RK1 b - - 11 22,f7f6 e5d6 d7c8 c1c6 b7c6 e2a6,2012,80,82,65,deflection long mate mateIn3 middlegame sacrifice,https://lichess.org/GzdjIrUz/black#44,,True,https://lichess.org/training/kkbTz
kvMf1,r1bq1knr/1p2b2p/p3PpBB/3p3Q/3n3N/8/PP3PPP/R4RK1 b - - 2 16,g8h6 h5h6 f8g8 g6f7,1260,76,95,14478,mate mateIn2 middlegame short,https://lichess.org/guNOZL9P/black#32,Sicilian_Defense Sicilian_Defense_Smith-Morra_Gambit_Declined,True,https://lichess.org/training/kvMf1
kwtMa,5r1k/pQ4pp/3p4/4R3/2P2r1b/1P1R1P1q/PB3P2/6K1 w - - 1 30,e5e8 f4g4 f3g4 h4f2,2112,86,79,81,mate mateIn2 middlegame sacrifice short,https://lichess.org/GjLhGoWt#59,,True,https://lichess.org/training/kwtMa
kzk9c,7k/p5b1/2np2pp/3N4/2QPP3/5P1q/P7/2R3K1 w - - 0 29,c4c6 g7d4 d5e3 d4e3,1002,84,90,419,endgame mate mateIn2 short,https://lichess.org/j1wMSbO0#57,,True,https://lichess.org/training/kzk9c
l1cRu,4rk2/p1b2ppp/8/8/6B1/2PqNP2/PP3P2/R3K2Q w - - 10 32,a1d1 e8e3 f2e3 c7g3,1762,77,83,139,mate mateIn2 middlegame sacrifice short,https://lichess.org/xTgHNVGD#63,,True,https://lichess.org/training/l1cRu
lBk9n,r7/p4kp1/1pb1p1r1/5p1Q/P1PRPq2/8/2B3PP/3R2K1 w - - 0 32,e4f5 f4e3 g1f1 c6g2,1615,74,73,275,mate mateIn2 middlegame short,https://lichess.org/lK5ZSkkY#63,,True,https://lichess.org/training/lBk9n
lJrCz,4kb2/2q2b2/2p1pQ2/B1Pp4/B2PpP2/P3K1P1/8/8 b - - 0 37,c7a5 a4c6,760,76,86,175,endgame mate mateIn1 oneMove,https://lichess.org/Rlj8Tu0a/black#74,,True,https://lichess.org/training/lJrCz
lKA3S,2brR3/4Q1pp/p5kr/8/2pq1p2/2N3B1/PPP3P1/R4K2 w - - 4 36,e8d8 h6h1 f1e2 c8g4,1562,77,84,70,mate mateIn2 middlegame short,https://lichess.org/IbIbwGv3#71,,True,https://lichess.org/training/lKA3S
lRppY,1bkr4/1p4p1/3q4/QN3p2/7p/P7/1P1BrP2/3RK3 w - - 0 28,e1e2 d6d3 e2e1 d8e8 d2e3 e8e3 f2e3 b8g3,2190,75,92,163,mate mateIn4 middlegame sacrifice veryLong,https://lichess.org/KcCvmhpu#55,,True,https://lichess.org/training/lRppY
lRwRq,6k1/8/6Q1/P2p2n1/6q1/8/5B1K/8 b - - 0 59,g8f8 f2c5,1075,77,94,1899,endgame master masterVsMaster mate mateIn1 oneMove,https://lichess.org/QR8BG2r2/black#118,,True,https://lichess.org/training/lRwRq
lT3aq,8/1p4kp/p3Bp2/2QP4/P5P1/1P1b3P/6K1/5q2 w - - 1 37,g2h2 f1f4 h2g2 d3e4 g2g1 f4g3 g1f1 e4d3,2053,127,52,14,endgame mate mateIn4 veryLong,https://lichess.org/AJwHJaQn#73,,True,https://lichess.org/training/lT3aq
lTdM5,q6k/8/pp3Qp1/1P4P1/P2p1P2/5b2/1B1b1Kn1/8 b - - 3 41,h8g8 f6g6 g8f8 b2a3 d2b4 a3b4,2178,75,95,1671,endgame exposedKing long mate mateIn3,https://lichess.org/e0JFmWoF/black#82,,True,https://lichess.org/training/lTdM5
lVmkv,r3k1r1/pb3p1p/1p2pQ1B/2p5/2B5/3PK1P1/PPP3qP/R7 b q - 4 19,g2h2 c4b5 b7c6 b5c6,1626,75,97,6836,mate mateIn2 middlegame short,https://lichess.org/yvKlGKKD/black#38,,True,https://lichess.org/training/lVmkv
lWny7,r1b1k2r/pp4pp/2nB4/3N4/3qN3/P7/2PK1bPP/R2Q1B1R w kq - 1 15,d2e2 c8g4,1829,79,93,8670,mate mateIn1 middlegame oneMove,https://lichess.org/36OBHQdN#29,Vienna_Game Vienna_Game_Vienna_Gambit,True,https://lichess.org/training/lWny7
lgUTI,2r5/7k/p3p2p/P3B1p1/3P4/2q3P1/2p2P1K/7Q b - - 4 40,c2c1q h1e4 h7g8 e4g6 g8f8 e5d6,1663,75,92,1346,endgame long mate mateIn3,https://lichess.org/DqbzPPKL/black#80,,True,https://lichess.org/training/lgUTI
liSS9,6r1/8/4p1pk/p1Q4p/4BP2/1q2PK1P/6P1/8 b - - 9 39,a5a4 c5g5 h6h7 g5h5 h7g7 h5g6 g7f8 g6f6 f8e8 e4c6,1841,73,94,16004,deflection endgame mate mateIn5 pin veryLong,https://lichess.org/PUhxMPVj/black#78,,True,https://lichess.org/training/liSS9
llhaj,3r1k2/pp5r/5PQ1/2Nb4/8/2P1q3/PP2B3/3KR3 w - - 5 31,g6h7 d5b3,1764,77,92,177,doubleCheck mate mateIn1 middlegame oneMove,https://lichess.org/BVmzxRWa#61,,True,https://lichess.org/training/llhaj
lmdgV,r6k/6b1/p3Q3/2p4P/1p1R4/q7/P1P1BP2/1K6 b - - 0 30,g7d4 e6h6 h8g8 e2c4,1742,200,41,12,endgame mate mateIn2 short,https://lichess.org/qyRsftgn/black#60,,True,https://lichess.org/training/lmdgV
ltq3z,r4rk1/1pp2ppp/p1np4/8/3PP1nb/1R3N1q/PPB2P2/RNBQ2K1 w - - 4 15,c1f4 h4f2,1085,77,90,1782,kingsideAttack mate mateIn1 middlegame oneMove,https://lichess.org/kI8Cd0Vu#29,Ruy_Lopez Ruy_Lopez_Steinitz_Defense,True,https://lichess.org/training/ltq3z
luWke,8/5pk1/Q4b2/7p/8/1B3qP1/P7/5K2 w - - 1 46,f1e1 f6c3,1232,78,90,205,endgame master mate mateIn1 oneMove,https://lichess.org/K4rJY5y5#91,,True,https://lichess.org/training/luWke
lv4IZ,2r5/5k2/2qp4/5QB1/1p6/1P6/1pP5/1K6 b - - 2 37,f7e8 f5e6 e8f8 g5h6,1668,77,85,60,endgame mate mateIn2 short,https://lichess.org/5n9328ae/black#74,,True,https://lichess.org/training/lv4IZ
lv6Mt,2kr1b1r/p2nn3/1ppQ1p1q/3P4/6PP/2PB4/PP3P2/R3K2R b KQ - 2 19,f6f5 d3a6,1608,86,90,1632,mate mateIn1 middlegame oneMove,https://lichess.org/hXHH5Z5l/black#38,Caro-Kann_Defense Caro-Kann_Defense_Classical_Variation,True,https://lichess.org/training/lv6Mt
lyaDG,r4rk1/1pp2ppp/p1np4/4p3/4P1nb/1BPP1NNq/PP3P2/R1BQR1K1 w - - 4 14,g3f5 h4f2,1324,122,85,47,kingsideAttack mate mateIn1 middlegame oneMove,https://lichess.org/rXGrpCbi#27,Italian_Game Italian_Game_Two_Knights_Defense,True,https://lichess.org/training/lyaDG
lzHs8,6k1/p4p2/1p2NQp1/6Pp/b6P/2P1P1q1/P7/R1Rr1K2 w - - 3 33,c1d1 a4b5 c3c4 b5c4 d1d3 c4d3,1548,74,93,271,endgame exposedKing long mate mateIn3,https://lichess.org/gjb9Wa6I#65,,True,https://lichess.org/training/lzHs8
m7C4W,2k1rq1r/pp2n3/2pQp3/2R2p2/3P2p1/2PB2Pp/PP3P1P/R5K1 b - - 1 25,e7d5 c5c6 b7c6 d3a6,1821,74,94,509,mate mateIn2 middlegame queensideAttack sacrifice short,https://lichess.org/UGstMBFX/black#50,,True,https://lichess.org/training/m7C4W
mDg3w,2Q2b1r/4kqpp/2p5/2p5/5N2/2B1P3/7P/6K1 b - - 1 24,f7e8 c8e6 e7d8 c3a5,1340,75,93,1045,endgame mate mateIn2 short,https://lichess.org/rf0xeWap/black#48,,True,https://lichess.org/training/mDg3w
mH15t,2b2k1r/5ppp/2Qb4/1N1P4/2K4q/8/PP3nPP/R1B4R w - - 3 18,c4b3 h4b4 b3c2 c8f5,1366,78,70,454,mate mateIn2 middlegame short,https://lichess.org/dM58UULr#35,Queens_Gambit_Declined Queens_Gambit_Declined_Austrian_Defense,True,https://lichess.org/training/mH15t
mL0lt,r5k1/ppp3pp/3p4/2b1n3/8/1PN2P1q/PBP1QP2/R2R2K1 w - - 0 18,e2f1 e5f3,818,84,95,1271,kingsideAttack mate mateIn1 middlegame oneMove,https://lichess.org/OTpeRrYz#35,Three_Knights_Opening Three_Knights_Opening_Other_variations,True,https://lichess.org/training/mL0lt
mOPxE,r6q/8/p2Q1p2/4p3/4P2b/1P1B4/k1PK1P2/R7 b - - 1 31,a2a1 d6a3 a1b1 c2c3,1502,76,87,306,discoveredAttack endgame mate mateIn2 short,https://lichess.org/vPSFdzqd/black#62,,True,https://lichess.org/training/mOPxE
mRtYQ,1k6/pp1q1pQ1/2p5/3p4/3P1b2/2P2N2/PP2P1K1/7r w - - 0 29,g2h1 d7h3 h1g1 f4e3,1359,74,78,829,endgame mate mateIn2 short,https://lichess.org/mxG7kDM5#57,,True,https://lichess.org/training/mRtYQ
mScnX,r1bq1knr/ppp1b2p/6BB/3pN2Q/3n4/8/PP3PPP/RN2K2R b KQ - 2 11,g8h6 h5h6 f8g8 g6f7,1368,76,85,548,mate mateIn2 opening short,https://lichess.org/GxuZzkgb/black#22,French_Defense French_Defense_Advance_Variation,True,https://lichess.org/training/mScnX
mVXQx,r2qr1k1/ppp2p2/3b1n1Q/5bN1/2Bn4/2N4P/PP3PP1/R4RK1 b - - 1 14,d6f4 c4f7,1092,78,91,184,kingsideAttack mate mateIn1 middlegame oneMove,https://lichess.org/tiFnc9fx/black#28,French_Defense French_Defense_Knight_Variation,True,https://lichess.org/training/mVXQx
mbUow,3rr3/2pk3p/2Q3p1/3P4/4n3/4B3/P3qPPP/1R2b1KR b - - 2 24,d7e7 c6e6 e7f8 e3h6,1714,77,94,13778,fork mate mateIn2 middlegame short,https://lichess.org/eMmP8LTu/black#48,,True,https://lichess.org/training/mbUow
mk1kY,k7/8/3Q1n2/3pp3/4P3/2PP2B1/P3KP2/1r4Nq b - - 3 34,h1g1 d6a6 a8b8 g3e5,1768,76,87,159,endgame fork mate mateIn2 short,https://lichess.org/F5NZLW5c/black#68,,True,https://lichess.org/training/mk1kY
mk5gN,5k2/p7/2p2pQ1/3p2p1/P2P3p/1P3NnP/2P1q3/2B3K1 b - - 3 35,e2f3 c1a3 c6c5 a3c5,1815,199,37,12,endgame mate mateIn2 short,https://lichess.org/r4WB8ZtE/black#70,,True,https://lichess.org/training/mk5gN
mpSv5,4k2r/3b1pp1/p6p/1pb1p3/2p1Nq2/2NP1P2/PPPK3P/R2Q3R w k - 4 21,d2e2 f4e3 e2f1 d7h3,1182,238,82,3,mate mateIn2 middlegame short,https://lichess.org/Xg6hsJC6#41,,True,https://lichess.org/training/mpSv5
msO4r,2r4k/1p4p1/5n1Q/1PB5/P3P3/2K2P2/4B1p1/1q6 b - - 4 39,h8g8 e2c4 f6d5 c4d5,820,90,96,546,endgame mate mateIn2 short,https://lichess.org/wOkY6uLd/black#78,,True,https://lichess.org/training/msO4r
mvFKb,r3k2r/pp3p2/3bpQ1p/3p4/3P4/1BP1B3/PP2KPP1/q7 b kq - 0 18,h8f8 b3a4 b7b5 a4b5,1538,76,88,105,mate mateIn2 middlegame short,https://lichess.org/KAYAiA1I/black#36,Caro-Kann_Defense Caro-Kann_Defense_Hillbilly_Attack,True,https://lichess.org/training/mvFKb
n0Oz5,5q2/k7/p2p4/1p1Bp2p/4P3/P2PQ3/KP3r2/8 b - - 5 41,a7b8 e3b6 b8c8 d5e6,1688,77,78,101,endgame mate mateIn2 short,https://lichess.org/u8Fkt7PD/black#82,,True,https://lichess.org/training/n0Oz5
n7Y2J,6k1/pp3p2/2p1p1nQ/6R1/3r1q1P/1B3P2/P1P2P2/6K1 b - - 4 31,f4h4 g5g6 f7g6 b3e6,1876,75,95,11301,deflection endgame mate mateIn2 short,https://lichess.org/kKJYrMno/black#62,,True,https://lichess.org/training/n7Y2J
nE4vE,r5r1/1b4k1/6p1/4Q3/1p2P3/1p6/qPP5/2K2B2 b - - 3 33,g7f8 e5f6 f8e8 f1b5 b7c6 b5c6,1472,74,94,2763,endgame exposedKing long master mate mateIn3,https://lichess.org/C5AijpNQ/black#66,,True,https://lichess.org/training/nE4vE
nEobI,1Q6/5pbk/B2Q2p1/3P4/4p3/6P1/7P/3q1K2 w - - 5 45,f1f2 d1f3 f2e1 g7c3,1931,79,82,324,endgame mate mateIn2 short,https://lichess.org/AxOoowuO#89,,True,https://lichess.org/training/nEobI
nPstr,7Q/p2k1ppp/p3p3/3p4/qb1P1B2/4PN2/5PPP/3K3R w - - 0 19,d1e2 a4b5 e2d1 b5d3 d1c1 b4a3,2299,79,93,4129,endgame long mate mateIn3,https://lichess.org/heeDVkoC#37,,True,https://lichess.org/training/nPstr
nTjbV,r1b1k2r/pp3ppp/8/2p5/2N4b/1P1PqnP1/PBP1B2P/R2QK2R w KQkq - 1 15,e1f1 c8h3,1568,78,79,79,mate mateIn1 oneMove opening,https://lichess.org/CVoB33T7#29,Sicilian_Defense Sicilian_Defense_Snyder_Variation,True,https://lichess.org/training/nTjbV
nVQyy,7k/p5p1/Q4b1p/7q/8/1P1P1P1r/P5P1/3RR2K w - - 0 31,g2h3 h5h3 h1g1 f6d4 e1e3 d4e3,1363,75,100,271,endgame exposedKing long mate mateIn3,https://lichess.org/BhAJReNm#61,,True,https://lichess.org/training/nVQyy
naUXj,rnb3k1/pp3Bq1/6Q1/8/8/4P3/P3KPP1/2B5 b - - 0 21,g8f8 c1a3,1304,85,50,62,mate mateIn1 middlegame oneMove,https://lichess.org/apCVU5of/black#42,,True,https://lichess.org/training/naUXj
nb2Tl,6r1/6k1/6Q1/8/4BP2/2pK3P/3b4/4q3 b - - 12 65,g7f8 g6f6 f8e8 e4c6,1651,79,100,51,endgame mate mateIn2 short,https://lichess.org/jsspYYOh/black#130,,True,https://lichess.org/training/nb2Tl
njA8A,5q1k/1Q6/8/4p3/P2bP3/3P1b2/2P3P1/5K2 w - - 2 38,g2f3 f8f3 f1e1 d4c3,1623,74,86,100,endgame mate mateIn2 short,https://lichess.org/vJa8M046#75,,True,https://lichess.org/training/njA8A
nnKJh,r3k2r/p4pBp/1p2p3/2p2b2/2B2Qn1/2PP3q/P1P2P1P/R4RK1 b kq - 0 15,h8g8 c4b5 e8d8 f4d6 d8c8 b5a6,2123,76,95,7004,long mate mateIn3 middlegame,https://lichess.org/B24sCGio/black#30,Scandinavian_Defense Scandinavian_Defense_Modern_Variation,True,https://lichess.org/training/nnKJh
no23S,rq3b1r/pp2nppp/4pk2/4n3/4QB1P/8/PP3PP1/R4RK1 b - - 0 16,e7g6 f4g5,1314,74,69,328,mate mateIn1 middlegame oneMove,https://lichess.org/mmsikUqx/black#32,Sicilian_Defense Sicilian_Defense_Smith-Morra_Gambit,True,https://lichess.org/training/no23S
noyV4,2k5/7p/3Qp1p1/4N3/8/6P1/3p1PKP/4qB2 b - - 9 40,d2d1q f1a6,1621,76,95,7709,endgame master mate mateIn1 oneMove,https://lichess.org/qIGPQ0aU/black#80,,True,https://lichess.org/training/noyV4
nqZkU,r1bqk1nr/ppN1b1pp/5p2/3pQ3/1P6/P1P5/5PPP/RN2KB1R b KQkq - 1 14,e8d7 f1b5,1392,74,95,8461,mate mateIn1 oneMove opening,https://lichess.org/RGYzO7om/black#28,French_Defense French_Defense_Advance_Variation,True,https://lichess.org/training/nqZkU
nu5dU,r1bqrnk1/ppp2p2/2np1b1Q/6N1/2BPP1P1/2N4P/PPP3K1/R4R2 b - - 2 17,f6g5 c4f7,1076,75,95,323,kingsideAttack mate mateIn1 middlegame oneMove,https://lichess.org/3HW5Uojy/black#34,Kings_Gambit_Accepted Kings_Gambit_Accepted_Cunningham_Defense,True,https://lichess.org/training/nu5dU
nzaWO,4r2k/1Q1R4/1p3pp1/2b3n1/4p3/2Pq2B1/P2K4/3R4 w - - 2 37,d2c1 c5a3,1572,86,53,522,master mate mateIn1 middlegame oneMove,https://lichess.org/uQFuRsBg#73,,True,https://lichess.org/training/nzaWO
o16eP,7k/1p6/6Q1/P1pq3p/3b4/7P/8/1R4K1 w - - 1 34,g1f1 d5f3 f1e1 d4c3,1816,309,22,8,endgame mate mateIn2 short,https://lichess.org/SJb4ePNH#67,,True,https://lichess.org/training/o16eP
o2vYC,1r6/5kb1/1p1Q4/1Pp3p1/2P1B3/3P2Pq/4P3/6K1 w - - 1 43,d6b8 g7d4 e2e3 d4e3,1026,83,95,2379,endgame mate mateIn2 short,https://lichess.org/lyUOhpxZ#85,,True,https://lichess.org/training/o2vYC
o7Pjw,8/2P2kpp/1q6/p7/2Rb1P2/1P2P3/6PP/1K6 w - - 0 29,c7c8q b6b3 b1c1 d4e3,1736,84,76,53,endgame mate mateIn2 short,https://lichess.org/ObA0gkf7#57,,True,https://lichess.org/training/o7Pjw
o81f1,2r1k1nr/pp3ppp/2n1p1b1/1BbpN3/6P1/1P2PP1q/PBP4P/RN1Q2KR w k - 0 13,e5g6 c5e3,899,77,72,131,kingsideAttack mate mateIn1 middlegame oneMove,https://lichess.org/Sp1aX4os#25,Queens_Pawn_Game Queens_Pawn_Game_Other_variations,True,https://lichess.org/training/o81f1
o9B39,1r6/2Q5/7k/p1p1p1bq/1p2P3/2PP3P/PP6/R6K w - - 2 33,c7b8 h5h3 h1g1 g5e3,1931,76,92,1134,endgame mate mateIn2 short,https://lichess.org/A1RYAY45#65,,True,https://lichess.org/training/o9B39
oIFua,4r3/Q1p3kp/1N1b2p1/8/2B1PP2/1P3bPq/P1PP3P/R5K1 w - - 0 21,c4f1 d6c5 d2d4 c5d4,1161,77,91,1051,master mate mateIn2 middlegame short,https://lichess.org/Z5ht3MVM#41,,True,https://lichess.org/training/oIFua
oIXEI,r4rk1/2p2ppp/p1np4/1p2p3/4P1nb/1BPP1NNq/PP3P2/R1BQR1K1 w - - 4 15,g3f5 h4f2,1143,77,92,142,kingsideAttack mate mateIn1 middlegame oneMove,https://lichess.org/qPp5UKyh#29,Ruy_Lopez Ruy_Lopez_Morphy_Defense,True,https://lichess.org/training/oIXEI
oIsj9,5b1k/Q6p/1p2P2r/5p2/8/1B2q2P/PP4P1/3R2K1 w - - 0 28,g1h1 h6h3 g2h3 e3h3 h1g1 f8c5 d1d4 c5d4,1642,74,89,765,endgame mate mateIn4 sacrifice veryLong,https://lichess.org/Ht6PMG4L#55,,True,https://lichess.org/training/oIsj9
oM1LK,8/5p2/2r1p2p/4B2q/Q7/p5P1/2k3K1/8 b - - 13 56,c2b1 a4b3 b1c1 e5f4,2125,79,79,264,endgame mate mateIn2 short,https://lichess.org/xGCUDAFP/black#112,,True,https://lichess.org/training/oM1LK
oOe1G,2Q1kr2/8/1p6/pb1Pp3/1q2Pp2/5P2/PP3BP1/1K6 b - - 0 32,e8e7 c8e6 e7d8 f2b6,2181,77,93,3294,endgame mate mateIn2 short,https://lichess.org/ZcxN9nB7/black#64,,True,https://lichess.org/training/oOe1G
oPk2Q,5k2/6pp/p7/1pB2p2/4pP2/1QPr3q/PP5P/4b2K b - - 3 31,f8e8 b3e6 e8d8 c5b6,1933,143,41,42,endgame mate mateIn2 short,https://lichess.org/P4jjPMeM/black#62,,True,https://lichess.org/training/oPk2Q
oPtvd,5rk1/ppN2ppp/2n5/3p2q1/3p2b1/6B1/PPP1KP1P/R2QR3 w - - 6 18,f2f3 g5e3 e2f1 g4h3,1797,91,77,24,mate mateIn2 middlegame short,https://lichess.org/EBoMYjkr#35,Four_Knights_Game Four_Knights_Game_Scotch_Variation,True,https://lichess.org/training/oPtvd
oTxHG,6k1/5p2/7p/2Q1P3/4b3/4N1qP/8/6K1 w - - 1 40,g1f1 e4d3,1553,82,80,937,endgame mate mateIn1 oneMove,https://lichess.org/O4jpPn4R#79,,True,https://lichess.org/training/oTxHG
oZJ9f,7k/p4p1p/2b1p2Q/P3qp2/8/2p3P1/2PK2P1/R7 w - - 0 38,d2d3 c6b5,1887,86,88,1159,endgame master masterVsMaster mate mateIn1 oneMove,https://lichess.org/IInkE6vp#75,,True,https://lichess.org/training/oZJ9f
oZxO6,4k3/8/pQ6/1p2P1p1/1b1Pq3/1P2P3/P1K5/5RR1 w - - 1 39,c2d1 e4d3 d1c1 b4a3,1889,119,66,68,endgame mate mateIn2 short,https://lichess.org/LSSoo5BF#77,,True,https://lichess.org/training/oZxO6
ogjxm,r2q1kBr/ppp3Rp/2np4/4p3/4P2b/3P1b2/PPPQ1P2/RNB1K3 b Q - 0 12,f8g7 d2h6 g7g8 h6e6 g8f8 c1h6,1418,77,92,3917,long mate mateIn3 middlegame sacrifice,https://lichess.org/UGzlZ7JT/black#24,Italian_Game Italian_Game_Paris_Defense,True,https://lichess.org/training/ogjxm
olpiz,r3k2r/pp5p/2nQ4/4p3/K1B1P1b1/4q3/PPP3PP/R4R2 b kq - 4 20,a8d8 c4f7,1384,75,90,292,mate mateIn1 middlegame oneMove,https://lichess.org/PcQzNWGo/black#40,,True,https://lichess.org/training/olpiz
omtK6,6k1/pb6/1p1p1r2/3P2Bp/3Q2q1/6P1/PP6/2R3K1 w - - 0 29,d4f6 g4g3 g1f1 b7a6 c1c4 a6c4,1417,168,84,17,endgame exposedKing long mate mateIn3,https://lichess.org/vDrsdWJ9#57,,True,https://lichess.org/training/omtK6
p4EiN,r1b1k1nr/ppp3pp/8/3B4/8/2N1qnP1/PPP1N2P/R2QK2R w KQkq - 4 14,e1f1 c8h3,1363,89,81,74,mate mateIn1 oneMove opening,https://lichess.org/DYviRsWV#27,Italian_Game Italian_Game_Rousseau_Gambit,True,https://lichess.org/training/p4EiN
p7frG,7r/p2k1pp1/Q7/2p4p/2N1p3/1P2P1q1/PB3KPb/2R5 w - - 1 27,f2e2 g3g2 e2d1 g2f1 d1d2 f1d3 d2e1 h2g3,1796,74,92,1666,mate mateIn4 middlegame veryLong,https://lichess.org/TguaRgf8#53,,True,https://lichess.org/training/p7frG
p9mEh,Q7/5p1k/4bB1p/4P3/5q2/8/5KP1/8 w - - 13 53,f2e1 f4e3 e1d1 e6b3,1795,74,94,12556,endgame mate mateIn2 short,https://lichess.org/ApRHOY3N#105,,True,https://lichess.org/training/p9mEh
pCNN3,8/pp2k3/4Q3/3P2b1/2P2p2/3BpPp1/Pq6/5K2 b - - 3 44,e7d8 e6d6 d8e8 d3g6,1960,78,86,247,endgame mate mateIn2 short,https://lichess.org/FaN10nCC/black#88,,True,https://lichess.org/training/pCNN3
pF7A3,5Nk1/pp5p/4Q1p1/P5B1/3p4/1P1P4/2P2qnb/7K b - - 1 42,g8f8 g5h6,1656,81,89,774,endgame master mate mateIn1 oneMove,https://lichess.org/HdacfoFR/black#84,,True,https://lichess.org/training/pF7A3
pOuMx,r2qr1k1/ppp1bp2/5npQ/5bN1/2BP3B/P1N5/1P3PPP/n3R1K1 b - - 1 18,e7f8 c4f7,1371,96,88,57,kingsideAttack mate mateIn1 middlegame oneMove,https://lichess.org/RVpEeqwq/black#36,French_Defense French_Defense_Exchange_Variation,True,https://lichess.org/training/pOuMx
pQLtm,r1q2kr1/pp2p3/2b2RQ1/5P2/4P3/P3B2P/2P5/5RK1 b - - 0 24,e7f6 e3c5,1510,79,78,687,mate mateIn1 middlegame oneMove,https://lichess.org/EYtgofeh/black#48,,True,https://lichess.org/training/pQLtm
pRxjz,4k3/1Q5b/4Np1p/1p1P2p1/6P1/1P2PPq1/8/6K1 w - - 6 49,g1f1 h7d3,1112,75,93,1116,endgame master mate mateIn1 oneMove,https://lichess.org/Wd4Xrns3#97,,True,https://lichess.org/training/pRxjz
pVQH4,5Q2/ppk2pp1/2p4p/8/3rP3/2NBqP2/bPP3PP/3K3R w - - 9 20,h1e1 d4d3 c2d3 a2b3,1926,77,85,180,mate mateIn2 middlegame sacrifice short,https://lichess.org/2oAkDqCP#39,,True,https://lichess.org/training/pVQH4
pq3RX,5k2/8/1p2b1Q1/4b2B/8/2N3Pq/PP5K/8 w - - 5 40,h2g1 e5d4,1185,76,100,267,endgame mate mateIn1 oneMove,https://lichess.org/qe1GzRFB#79,,True,https://lichess.org/training/pq3RX
psTN5,6k1/p1p2ppp/8/2p1Qb2/2P1n3/qr2B3/2P2PPP/1K1R3R w - - 0 23,c2b3 e4d2,993,78,86,317,doubleCheck mate mateIn1 middlegame oneMove,https://lichess.org/KB7YIOIA#45,,True,https://lichess.org/training/psTN5
ptlNH,6k1/1b2Q3/1p3p1p/p2P2bP/P7/2B3q1/6B1/3R3K w - - 9 37,e7b7 g3h4 g2h3 h4h3 h1g1 g5e3,1424,74,98,917,endgame exposedKing fork long master mate mateIn3,https://lichess.org/p3jAsuBg#73,,True,https://lichess.org/training/ptlNH
pu203,r2q1r2/1p2k1p1/2b1p1Q1/1p1p2N1/3B4/b6P/5PP1/5RK1 b - - 3 25,d8e8 g6e6 e7d8 d4b6,1746,75,100,612,mate mateIn2 middlegame short,https://lichess.org/Q0qC9nUD/black#50,,True,https://lichess.org/training/pu203
pxZXG,7k/p1p5/3b2Qp/2p5/8/2P3P1/PP3qB1/7K b - - 1 36,f2g3 g6h6 h8g8 g2d5,1648,75,86,96,endgame mate mateIn2 short,https://lichess.org/xSRdN0bt/black#72,,True,https://lichess.org/training/pxZXG
pz5gf,6k1/1p5p/4p1p1/1BP5/1P1b2q1/5n2/4N1KP/1Q5R w - - 6 27,e2g3 f3h4 g2f1 g4f3 f1e1 d4c3,2077,76,94,1538,long mate mateIn3 middlegame,https://lichess.org/9BqfnEYN#53,,True,https://lichess.org/training/pz5gf
q0OPI,4r3/p1R4Q/2Pp1pp1/4kq2/1bP5/8/4NPPP/4K2R w K - 1 24,e1d1 f5d3 d1c1 b4a3,1997,76,94,4633,mate mateIn2 middlegame short,https://lichess.org/rpxhXIpW#47,,True,https://lichess.org/training/q0OPI
q2fvE,r5k1/1b1n1p2/p3pnpQ/1pq5/8/1B1P1NR1/P1P2PPP/6K1 b - - 3 23,c5c3 g3g6 f7g6 b3e6,1844,76,93,8523,deflection kingsideAttack mate mateIn2 middlegame sacrifice short,https://lichess.org/Mx2RYMHM/black#46,,True,https://lichess.org/training/q2fvE
q2g6Y,7k/7p/3q1p1Q/3b1B2/3p3P/6r1/5P2/1R4K1 w - - 0 40,f2g3 d6g3 g1f1 d5c4 f5d3 c4d3,1871,75,95,311,endgame exposedKing long master mate mateIn3,https://lichess.org/yMBTXiAT#79,,True,https://lichess.org/training/q2g6Y
q6mOX,Q7/1pk1b1p1/p7/3pPbP1/1P1B4/P2q3P/8/R5KR w - - 2 30,a8a7 d3g3 g1f1 f5d3,1349,75,93,1739,mate mateIn2 middlegame short,https://lichess.org/EArRGcr0#59,,True,https://lichess.org/training/q6mOX
q8cqW,8/p3kpQp/4pn2/1b6/3q1N2/6P1/1p3PBP/1R1KR3 w - - 0 30,d1c2 b5a4,1613,75,95,8528,mate mateIn1 middlegame oneMove,https://lichess.org/PSqVxoHF#59,,True,https://lichess.org/training/q8cqW
qBKhf,8/pp1k4/2p5/4QB1p/1P1P2bq/8/1P2p1P1/6K1 b - - 7 45,d7d8 e5d6 d8e8 f5g6,1802,77,75,170,endgame mate mateIn2 short,https://lichess.org/GCuEmvm4/black#90,,True,https://lichess.org/training/qBKhf
qBkog,r3k2r/ppp2pp1/1b2bn1p/8/4P3/3NqPP1/PPPNK2P/R1BQ3R w kq - 3 14,e2f1 e6h3,1351,74,100,284,mate mateIn1 middlegame oneMove,https://lichess.org/OlXiWd0P#27,Mieses_Opening Mieses_Opening_Other_variations,True,https://lichess.org/training/qBkog
qJ0Bu,r2qrk2/p3n2p/2b1Q1p1/2bp2B1/8/8/PPP2PPP/RN3RK1 b - - 3 17,d8d7 g5h6,1582,75,96,526,mate mateIn1 middlegame oneMove,https://lichess.org/sERs594t/black#34,Sicilian_Defense Sicilian_Defense_Modern_Variations,True,https://lichess.org/training/qJ0Bu
qQM7R,5k1r/pp1Q2pp/8/8/4P3/2P1q2N/bP4PP/2K4R w - - 5 22,c1d1 a2b3,993,77,98,771,endgame mate mateIn1 oneMove,https://lichess.org/0EEwsyZM#43,,True,https://lichess.org/training/qQM7R
qeDq8,3r4/2k2pBp/5Q2/pB6/2P3P1/Pq5P/3KPb2/R6R w - - 1 28,d2c1 f2e3,1122,217,47,11,mate mateIn1 middlegame oneMove,https://lichess.org/YMvkXQWf#55,,True,https://lichess.org/training/qeDq8
qgQhc,6k1/pp6/2b1Q1p1/4p3/2p1q3/4B2P/PPP3PK/8 b - - 3 29,g8f8 e3h6,1262,75,98,1209,endgame mate mateIn1 oneMove,https://lichess.org/yivEHqwp/black#58,,True,https://lichess.org/training/qgQhc
